[
  {
    "id": "feat:balm-of-the-summer-court",
    "class": "subclass:circle-of-dreams",
    "level": 2,
    "name": "Balm of the Summer Court",
    "description": "You become imbued with the blessings of the Summer Court. You are a font of energy that offers respite from injuries. You have a pool of fey energy represented by a number of d6s equal to your druid level. As a bonus action, you can choose one creature you can see within 120 feet of you and spend a number of those dice equal to half your druid level or fewer. Roll the spent dice and add them together. The target regains a number of hit points equal to the total. The target also gains 1 temporary hit point per die spent. You regain all expended dice when you finish a long rest.",
    "mechanics": [
      {
        "type": "resource",
        "id": "fey_energy",
        "name": "Fey Energy",
        "count": {
          "type": "class_level",
          "class": "class:druid"
        },
        "dice_sides": 6,
        "recharge": "long_rest"
      },
      {
        "type": "bonus_action",
        "name": "Fey Balm",
        "cost": [
          {
            "resource": "fey_energy",
            "choice_type": "resource",
            "minimum": 1,
            "limit": {
              "scaling": "max_dice"
            }
          }
        ],
        "target": {
          "type": "creature",
          "count": 1,
          "disposition": "friendly",
          "requirements": [
            {
              "type": "perception",
              "observer": "character",
              "subject": "target",
              "senses": ["sight"]
            }
          ]
        },
        "range": {
          "value": 120,
          "unit": "feet"
        },
        "effects": [
          {
            "healing": {
              "calculation": {
                "operation": "add",
                "operators": [
                  {
                    "type": "resource_die",
                    "value": "fey_energy"
                  }
                ]
              }
            }
          },
          {
            "healing": {
              "barrier": {
                "id": "fey_balm_temp_hp",
                "priority": 1
              },
              "calculation": {
                "operation": "set",
                "operators": [
                  {
                    "type": "resource",
                    "value": "fey_energy",
                    "property": "current"
                  }
                ]
              }
            }
          }
        ],
        "scaling": {
          "components": {
            "max_dice": {
              "by_level": {
                "2": 1,
                "4": 2,
                "6": 3,
                "8": 4,
                "10": 5,
                "12": 6,
                "14": 7,
                "16": 8,
                "18": 9,
                "20": 10
              }
            }
          }
        }
      }
    ],
    "source": "xge",
    "ruleset": "dnd5e"
  },
  {
    "id": "feat:hearth-of-moonlight-and-shadow",
    "class": "subclass:circle-of-dreams",
    "level": 6,
    "name": "Hearth of Moonlight and Shadow",
    "description": "Home can be wherever you are. During a short or long rest, you can invoke the shadowy power of the Gleaming Court to help guard your respite. At the start of the rest, you touch a point in space, and an invisible, 30-foot-radius sphere of magic appears, centered on that point. Total cover blocks the sphere. While within the sphere, you and your allies gain a +5 bonus to Dexterity (Stealth) and Wisdom (Perception) checks, and any light from open flames in the sphere (a campfire, torches, or the like) isn't visible outside it. The sphere vanishes at the end of the rest or when you leave the sphere.",
    "mechanics": [
      {
        "type": "special",
        "name": "hearth_ward",
        "trigger": {
          "event": ["short_rest", "long_rest"]
        },
        "effects": [
          {
            "aura": {
              "origin": "point",
              "radius": 30,
              "unit": "feet",
              "shape": "sphere",
              "target": {
                "type": "creatures",
                "disposition": "friendly",
                "include_self": true
              },
              "grants": {
                "attribute": {
                  "target": "skill.Stealth",
                  "calculation": {
                    "operation": "add",
                    "operators": [
                      {
                        "type": "integer",
                        "value": 5
                      }
                    ]
                  }
                }
              }
            }
          },
          {
            "aura": {
              "origin": "point",
              "radius": 30,
              "unit": "feet",
              "shape": "sphere",
              "target": {
                "type": "creatures",
                "disposition": "friendly",
                "include_self": true
              },
              "grants": {
                "attribute": {
                  "target": "skill.Perception",
                  "calculation": {
                    "operation": "add",
                    "operators": [
                      {
                        "type": "integer",
                        "value": 5
                      }
                    ]
                  }
                }
              }
            }
          }
        ]
      }
    ],
    "source": "xge",
    "ruleset": "dnd5e"
  },
  {
    "id": "feat:hidden-paths",
    "class": "subclass:circle-of-dreams",
    "level": 10,
    "name": "Hidden Paths",
    "description": "You can use the hidden, magical pathways that some fey use to traverse space in the blink of an eye. As a bonus action on your turn, you can teleport up to 60 feet to an unoccupied space you can see. Alternatively, you can use your action to teleport one willing creature you touch up to 30 feet to an unoccupied space you can see. You can use this feature a number of times equal to your Wisdom modifier (minimum of once), and you regain all expended uses of it when you finish a long rest.",
    "mechanics": [
      {
        "type": "resource",
        "id": "hidden_paths",
        "name": "Hidden Paths",
        "count": {
          "type": "ability_modifier",
          "ability": "Wisdom",
          "bounds": {
            "minimum": 1
          }
        },
        "recharge": "long_rest"
      },
      {
        "type": "bonus_action",
        "cost": [
          {
            "resource": "hidden_paths",
            "amount": 1
          }
        ],
        "effects": [
          {
            "movement": {
              "type": "teleport",
              "distance": 60
            },
            "target": {
              "type": "self"
            }
          }
        ]
      },
      {
        "type": "action",
        "cost": [
          {
            "resource": "hidden_paths",
            "amount": 1
          }
        ],
        "target": {
          "type": "creature",
          "count": 1,
          "disposition": "willing"
        },
        "range": {
          "value": 5,
          "unit": "feet"
        },
        "effects": [
          {
            "movement": {
              "type": "teleport",
              "distance": 30
            }
          }
        ]
      }
    ],
    "source": "xge",
    "ruleset": "dnd5e"
  },
  {
    "id": "feat:walker-in-dreams",
    "class": "subclass:circle-of-dreams",
    "level": 14,
    "name": "Walker in Dreams",
    "description": "The magic of the Feywild grants you the ability to travel mentally or physically through dreamlands. When you finish a short rest, you can cast one of the following spells, without expending a spell slot or requiring material components: dream (with you as the messenger), scrying, or teleportation circle. This use of teleportation circle is special. Rather than opening a portal to a permanent teleportation circle, it opens a portal to the last place where you finished a long rest on your current plane of existence. You can use this feature once, and you regain the ability to do so when you finish a long rest.",
    "mechanics": [
      {
        "type": "passive",
        "trigger": {
          "event": ["short_rest"]
        },
        "uses": {
          "value": 1
        },
        "recharge": "long_rest",
        "grants": {
          "name": "Walker in Dreams",
          "interaction": {
            "type": "spell",
            "spell": "spell:dream",
            "slot": false,
            "ignore_requirements": ["material"]
          }
        }
      },
      {
        "type": "passive",
        "trigger": {
          "event": ["short_rest"]
        },
        "uses": {
          "value": 1
        },
        "recharge": "long_rest",
        "grants": {
          "name": "Walker in Dreams",
          "interaction": {
            "type": "spell",
            "spell": "spell:scrying",
            "slot": false,
            "ignore_requirements": ["material"]
          }
        }
      },
      {
        "type": "passive",
        "trigger": {
          "event": ["short_rest"]
        },
        "uses": {
          "value": 1
        },
        "recharge": "long_rest",
        "grants": {
          "name": "Walker in Dreams",
          "interaction": {
            "type": "spell",
            "spell": "spell:teleportation-circle",
            "slot": false,
            "ignore_requirements": ["material"]
          }
        }
      }
    ],
    "source": "xge",
    "ruleset": "dnd5e"
  }
]
