[
  {
    "id": "feat:order-domain-spells",
    "level": 1,
    "name": "Domain Spells",
    "description": "You gain domain spells at the cleric levels listed. Once you gain a domain spell, you always have it prepared, and it doesn't count against the number of spells you can prepare each day.",
    "source": "tce",
    "ruleset": "dnd5e",
    "class": "domain:order",
    "mechanics": [
      {
        "type": "granted_spells",
        "always_prepared": true,
        "scaling": {
          "by_level": {
            "1": ["spell:command", "spell:heroism"],
            "3": ["spell:hold-person", "spell:zone-of-truth"],
            "5": ["spell:mass-healing-word", "spell:slow"],
            "7": ["spell:compulsion", "spell:locate-creature"],
            "9": ["spell:commune", "spell:dominate-person"]
          }
        }
      }
    ]
  },
  {
    "id": "feat:order-bonus-proficiencies",
    "level": 1,
    "name": "Bonus Proficiencies",
    "description": "When you choose this domain at 1st level, you gain proficiency with heavy armor. You also gain proficiency in the Intimidation or Persuasion skill (your choice).",
    "source": "tce",
    "ruleset": "dnd5e",
    "class": "domain:order",
    "mechanics": [
      {
        "type": "proficiency",
        "category": "armor",
        "proficiencies": ["prop:heavy"]
      },
      {
        "type": "choice",
        "choice_type": "skill",
        "count": 1,
        "options": [
          {
            "type": "simple",
            "name": "Intimidation"
          },
          {
            "type": "simple",
            "name": "Persuasion"
          }
        ],
        "effects": [
          {
            "buff": {
              "category": "proficiency",
              "subcategory": "skill"
            }
          }
        ]
      }
    ]
  },
  {
    "id": "feat:order-voice-of-authority",
    "level": 1,
    "name": "Voice of Authority",
    "description": "Starting at 1st level, you can invoke the power of law to embolden an ally to attack. If you cast a spell with a spell slot of 1st level or higher and target an ally with the spell, that ally can use their reaction immediately after the spell to make one weapon attack against a creature of your choice that you can see.\n\nIf the spell targets more than one ally, you choose the ally who can make the attack.",
    "source": "tce",
    "ruleset": "dnd5e",
    "class": "domain:order",
    "mechanics": [
      {
        "type": "passive",
        "name": "Voice of Authority",
        "trigger": {
          "event": ["cast_spell"],
          "source": {
            "type": "spell",
            "level": {
              "minimum": 1
            }
          }
        },
        "target": {
          "type": "creature",
          "count": 1,
          "disposition": "friendly",
          "choice": true
        },
        "effects": [
          {
            "grants": {
              "name": "Attack",
              "activation": "reaction",
              "action": "weapon_attack",
              "count": 1
            }
          }
        ]
      }
    ]
  },
  {
    "id": "feat:order-orders-demand",
    "level": 2,
    "name": "Order's Demand",
    "description": "Starting at 2nd level, you can use your Channel Divinity to exert an intimidating presence over others.\n\nAs an action, you present your holy symbol, and each creature of your choice that can see or hear you within 30 feet of you must succeed on a Wisdom saving throw or be charmed by you until the end of your next turn or until the charmed creature takes any damage. You can also cause any of the charmed creatures to drop what they are holding when they fail the saving throw.",
    "source": "tce",
    "ruleset": "dnd5e",
    "class": "domain:order",
    "mechanics": [
      {
        "type": "action",
        "name": "Order's Demand",
        "cost": [
          {
            "resource": "channel_divinity",
            "amount": 1
          }
        ],
        "target": {
          "type": "creature",
          "disposition": "hostile",
          "choice": true
        },
        "range": {
          "value": 30,
          "unit": "feet"
        },
        "saving_throw": {
          "ability": ["Wisdom"],
          "dc": {
            "ref": "spell_save_dc"
          }
        },
        "on_failure": {
          "apply_status": {
            "id": "status:charmed",
            "source": "character",
            "duration": {
              "value": 1,
              "unit": "turns",
              "timing": "end_turn",
              "until": ["damaged_by"]
            }
          }
        }
      }
    ]
  },
  {
    "id": "feat:order-embodiment-of-the-law",
    "level": 6,
    "name": "Embodiment of the Law",
    "description": "At 6th level, you become remarkably adept at channeling magical energy to compel others.\n\nIf you cast a spell of the enchantment school using a spell slot of 1st level or higher, you can change the spell's casting time to 1 bonus action for this casting, provided the spell's casting time is normally 1 action.\n\nYou can use this feature a number of times equal to your Wisdom modifier (minimum of once), and you regain all expended uses of it when you finish a long rest.",
    "source": "tce",
    "ruleset": "dnd5e",
    "class": "domain:order",
    "mechanics": [
      {
        "type": "passive",
        "name": "Embodiment of the Law",
        "requirements": [
          {
            "type": "spell",
            "school": "Enchantment"
          }
        ],
        "effects": [
          {
            "attribute": {
              "target": "casting_time",
              "calculation": {
                "operation": "set",
                "operators": [
                  {
                    "type": "string",
                    "value": "bonus_action"
                  }
                ]
              }
            }
          }
        ],
        "uses": {
          "calculation": "scores.wisdom.modifier",
          "bounds": {
            "minimum": 1
          }
        },
        "recharge": "long_rest"
      }
    ]
  },
  {
    "id": "feat:order-divine-strike",
    "level": 8,
    "name": "Divine Strike",
    "description": "At 8th level, you gain the ability to infuse your weapon strikes with divine energy. Once on each of your turns when you hit a creature with a weapon attack, you can cause the attack to deal an extra 1d8 psychic damage to the target. When you reach 14th level, the extra damage increases to 2d8.",
    "source": "tce",
    "ruleset": "dnd5e",
    "class": "domain:order",
    "mechanics": [
      {
        "type": "damage_bonus",
        "name": "divine_strike",
        "trigger": {
          "event": ["damage"],
          "source": {
            "type": "weapon"
          }
        },
        "effects": [
          {
            "damage_bonus": {
              "dice": "1d8",
              "type": ["psychic"]
            }
          }
        ],
        "scaling": {
          "by_level": {
            "14": "2d8"
          }
        }
      }
    ]
  },
  {
    "id": "feat:order-orders-wrath",
    "level": 17,
    "name": "Order's Wrath",
    "description": "Starting at 17th level, enemies you designate for destruction wilt under the combined efforts of you and your allies. If you deal your Divine Strike damage to a creature on your turn, you can curse that creature until the start of your next turn. The next time one of your allies hits the cursed creature with an attack, the target also takes 2d8 psychic damage, and the curse ends. You can curse a creature in this way only once per turn.",
    "source": "tce",
    "ruleset": "dnd5e",
    "class": "domain:order",
    "enhances": ["feat:order-divine-strike"],
    "mechanics": [
      {
        "type": "passive",
        "name": "orders_wrath",
        "trigger": {
          "event": ["damage"],
          "source": {
            "type": "weapon"
          }
        },
        "effects": [
          {
            "apply_status": {
              "id": "status:orders-wrath",
              "source": "character",
              "duration": {
                "value": 1,
                "unit": "turns",
                "timing": "start_turn"
              },
              "effects": [
                {
                  "damage": {
                    "bonus": {
                      "operation": "add",
                      "operators": [
                        {
                          "type": "dice",
                          "dice": "2d8"
                        }
                      ]
                    },
                    "type": ["psychic"]
                  }
                }
              ]
            }
          }
        ]
      }
    ]
  }
]
