[
  {
    "id": "feat:training-in-war-and-song",
    "class": "subclass:bladesinging",
    "level": 2,
    "name": "Training in War and Song",
    "description": "When you adopt this tradition, you gain proficiency with light armor, and you gain proficiency with one type of one-handed melee weapon of your choice. You also gain proficiency in the Performance skill if you don't already have it.",
    "mechanics": [
      {
        "type": "proficiency",
        "category": "armor",
        "proficiencies": ["prop:light"]
      },
      {
        "type": "proficiency",
        "category": "skill",
        "proficiencies": ["Performance"]
      },
      {
        "type": "choice",
        "choice_type": "query",
        "name": "Melee Weapon Proficiency",
        "count": 1,
        "query": {
          "source": "weapons",
          "params": {
            "category": "melee",
            "exclude_properties": ["Two-handed"]
          }
        }
      }
    ],
    "source": "tce",
    "ruleset": "dnd5e"
  },
  {
    "id": "feat:bladesong",
    "class": "subclass:bladesinging",
    "level": 2,
    "name": "Bladesong",
    "description": "Starting at 2nd level, you can invoke an elven magic called the Bladesong, provided that you aren't wearing medium or heavy armor or using a shield. It graces you with supernatural speed, agility, and focus.\n\nYou can use a bonus action to start the Bladesong, which lasts for 1 minute. It ends early if you are incapacitated, if you don medium or heavy armor or a shield, or if you use two hands to make an attack with a weapon. You can also dismiss the Bladesong at any time (no action required).\n\nWhile your Bladesong is active, you gain the following benefits:\n- You gain a bonus to your AC equal to your Intelligence modifier (minimum of +1).\n- Your walking speed increases by 10 feet.\n- You have advantage on Acrobatics checks.\n- You gain a bonus to any Constitution saving throw you make to maintain your concentration on a spell. The bonus equals your Intelligence modifier (minimum of +1).\n\nYou can use this feature a number of times equal to your proficiency bonus, and you regain all expended uses when you finish a long rest.",
    "mechanics": [
      {
        "type": "bonus_action",
        "name": "Bladesong",
        "uses": {
          "calculation": "proficiency_bonus",
          "bounds": {
            "minimum": 1
          }
        },
        "recharge": "long_rest",
        "duration": {
          "value": 1,
          "unit": "minutes"
        },
        "requirements": [
          {
            "type": "equipment",
            "slot": "armor",
            "property": ["Medium", "Heavy"],
            "negate": true
          },
          {
            "type": "equipment",
            "slot": "off_hand",
            "item": ["Shield"],
            "negate": true
          }
        ],
        "effects": [
          {
            "apply_status": {
              "id": "status:bladesinging"
            }
          },
          {
            "buff": {
              "category": "armor_class",
              "bonus": {
                "operation": "add",
                "operators": [
                  {
                    "type": "ability_modifier",
                    "ability": "Intelligence"
                  }
                ],
                "bounds": {
                  "minimum": 1
                }
              }
            }
          },
          {
            "buff": {
              "category": "movement",
              "property": "base",
              "bonus": {
                "operation": "add",
                "operators": [
                  {
                    "type": "integer",
                    "value": 10
                  }
                ]
              }
            }
          },
          {
            "advantage": {
              "skill": "Acrobatics"
            }
          },
          {
            "buff": {
              "category": "saving_throw",
              "saving_throw": "Constitution",
              "bonus": {
                "operation": "add",
                "operators": [
                  {
                    "type": "ability_modifier",
                    "ability": "Intelligence"
                  }
                ],
                "bounds": {
                  "minimum": 1
                }
              }
            },
            "trigger": {
              "event": ["saving_throw"]
            },
            "requirements": [
              {
                "type": "concentration",
                "active": true
              }
            ]
          }
        ]
      }
    ],
    "source": "tce",
    "ruleset": "dnd5e"
  },
  {
    "id": "feat:extra-attack-bladesinger",
    "class": "subclass:bladesinging",
    "level": 6,
    "name": "Extra Attack",
    "description": "Starting at 6th level, you can attack twice, instead of once, whenever you take the Attack action on your turn. Moreover, you can cast one of your cantrips in place of one of those attacks.",
    "mechanics": [
      {
        "type": "extra_attack",
        "scaling": {
          "components": {
            "attacks": {
              "by_level": {
                "6": 2
              }
            }
          }
        },
        "grants": {
          "name": "Cast Spell",
          "action": "cast_spell",
          "type": "cantrip",
          "count": 1
        }
      }
    ],
    "source": "tce",
    "ruleset": "dnd5e"
  },
  {
    "id": "feat:song-of-defense",
    "class": "subclass:bladesinging",
    "level": 10,
    "name": "Song of Defense",
    "description": "Beginning at 10th level, you can direct your magic to absorb damage while your Bladesong is active. When you take damage, you can use your reaction to expend one spell slot and reduce that damage to you by an amount equal to five times the spell slot's level.",
    "enhances": ["feat:bladesong"],
    "mechanics": [
      {
        "type": "reaction",
        "trigger": {
          "event": ["damaged_by"]
        },
        "cost": [
          {
            "resource": "spell_slot",
            "amount": 1,
            "choice_type": "character_resource"
          }
        ],
        "effects": [
          {
            "calculation": {
              "operation": "subtract",
              "operators": [
                {
                  "type": "calculation",
                  "operation": "multiply",
                  "operators": [
                    {
                      "type": "cost",
                      "resource": "spell_slot"
                    },
                    {
                      "type": "integer",
                      "value": 5
                    }
                  ]
                }
              ]
            }
          }
        ]
      }
    ],
    "source": "tce",
    "ruleset": "dnd5e"
  },
  {
    "id": "feat:song-of-victory",
    "class": "subclass:bladesinging",
    "level": 14,
    "name": "Song of Victory",
    "description": "Starting at 14th level, you can add your Intelligence modifier (minimum of +1) to the damage of your melee weapon attacks while your Bladesong is active.",
    "enhances": ["feat:bladesong"],
    "mechanics": [
      {
        "type": "damage_bonus",
        "trigger": {
          "event": ["damage"],
          "source": {
            "type": "weapon",
            "mode": "melee"
          }
        },
        "effects": [
          {
            "damage_bonus": {
              "calculation": {
                "operation": "add",
                "operators": [
                  {
                    "type": "ability_modifier",
                    "ability": "Intelligence"
                  }
                ]
              },
              "inherit_type": true
            }
          }
        ]
      }
    ],
    "source": "tce",
    "ruleset": "dnd5e"
  }
]
