[
  {
    "id": "feat:wildfire-circle-spells",
    "class": "subclass:circle-of-wildfire",
    "level": 2,
    "name": "Circle Spells",
    "description": "You have formed a bond with a wildfire spirit, a primal being of creation and destruction. Your link with this spirit grants you access to some spells when you reach certain levels in this class.",
    "mechanics": [
      {
        "type": "granted_spells",
        "always_prepared": true,
        "scaling": {
          "by_level": {
            "2": ["spell:burning-hands", "spell:cure-wounds"],
            "3": ["spell:flaming-sphere", "spell:scorching-ray"],
            "5": ["spell:plant-growth", "spell:revivify"],
            "7": ["spell:aura-of-life", "spell:fire-shield"],
            "9": ["spell:flame-strike", "spell:mass-cure-wounds"]
          }
        }
      }
    ],
    "source": "tce",
    "ruleset": "dnd5e"
  },
  {
    "id": "feat:summon-wildfire-spirit",
    "class": "subclass:circle-of-wildfire",
    "level": 2,
    "name": "Summon Wildfire Spirit",
    "description": "As an action, you can expend one use of your Wild Shape feature to summon your wildfire spirit, rather than assuming a beast form. The spirit appears in an unoccupied space of your choice that you can see within 30 feet of you. Each creature within 10 feet of the spirit (other than you) when it appears must succeed on a Dexterity saving throw against your spell save DC or take 2d6 fire damage. The spirit is friendly to you and your companions and obeys your commands. It uses the Wildfire Spirit stat block. In combat, the spirit shares your initiative count, but it takes its turn immediately after yours. The only action it can take on its turn is the Dodge action, unless you take a bonus action on your turn to command it to take another action. If the spirit has died within the last hour, you can use your Wild Shape feature to summon it again, and it returns with all its hit points restored. The spirit disappears if it is reduced to 0 hit points, if you use this feature to summon the spirit again, if you die, or if you dismiss the spirit (no action).",
    "mechanics": [
      {
        "type": "action",
        "cost": [
          {
            "resource": "wild_shape",
            "amount": 1
          }
        ],
        "effects": [
          {
            "entity": {
              "category": "creature",
              "type": "wildfire_spirit",
              "target": null
            }
          },
          {
            "saving_throw": {
              "ability": "Dexterity",
              "dc": {
                "ref": "spell_save_dc"
              }
            },
            "on_failure": {
              "damage": {
                "dice": "2d6",
                "type": ["fire"]
              }
            },
            "target": {
              "type": "creatures",
              "disposition": "any",
              "include_self": false
            },
            "area": {
              "shape": "radius",
              "size": 10,
              "unit": "feet",
              "origin": "self"
            }
          }
        ],
        "range": {
          "value": 30,
          "unit": "feet"
        }
      }
    ],
    "source": "tce",
    "ruleset": "dnd5e"
  },
  {
    "id": "feat:enhanced-bond",
    "class": "subclass:circle-of-wildfire",
    "level": 6,
    "name": "Enhanced Bond",
    "description": "The connection between you and your wildfire spirit enhances your destructive and restorative spells. Whenever you cast a spell that deals fire damage or restores hit points while your wildfire spirit is summoned, roll a d8, and you gain a bonus to one damage roll or one healing roll of the spell equal to the number rolled. In addition, when you cast a spell with a range other than self, the spell can originate from you or from your wildfire spirit.",
    "mechanics": [
      {
        "type": "passive",
        "trigger": {
          "event": ["cast_spell"],
          "source": {
            "type": "spell",
            "effect": ["healing"]
          }
        },
        "effects": [
          {
            "healing": {
              "dice": "1d8"
            }
          }
        ]
      },
      {
        "type": "passive",
        "trigger": {
          "event": ["cast_spell"],
          "source": {
            "type": "spell"
          }
        },
        "requirements": [
          {
            "type": "property",
            "value": "fire"
          }
        ],
        "effects": [
          {
            "damage_bonus": {
              "dice": "1d8",
              "type": ["fire"]
            }
          }
        ]
      }
    ],
    "source": "tce",
    "ruleset": "dnd5e"
  },
  {
    "id": "feat:cauterizing-flames",
    "class": "subclass:circle-of-wildfire",
    "level": 10,
    "name": "Cauterizing Flames",
    "description": "You gain the ability to turn death into magical flames that can heal or incinerate. When a Small or larger creature dies within 30 feet of you or your wildfire spirit, a harmless spectral flame springs forth in the dead creature's space and flickers there for 1 minute. When a creature you can see enters that space, you can use your reaction to extinguish the spectral flame there and either heal the creature or deal fire damage to it. The healing or damage equals 2d10 + your Wisdom modifier. You can use this reaction a number of times equal to your proficiency bonus, and you regain all expended uses when you finish a long rest.",
    "mechanics": [
      {
        "type": "resource",
        "id": "cauterizing_flames",
        "name": "Cauterizing Flames",
        "count": {
          "type": "proficiency_bonus"
        },
        "recharge": "long_rest"
      },
      {
        "type": "reaction",
        "cost": [
          {
            "resource": "cauterizing_flames",
            "amount": 1
          }
        ],
        "trigger": {
          "event": ["enter_area"]
        },
        "effects": [
          {
            "healing": {
              "dice": "2d10",
              "bonus": {
                "operation": "add",
                "operators": [{ "type": "ability_modifier", "ability": "Wisdom" }]
              }
            }
          },
          {
            "damage": {
              "dice": "2d10",
              "type": ["fire"],
              "bonus": {
                "operation": "add",
                "operators": [{ "type": "ability_modifier", "ability": "Wisdom" }]
              }
            }
          }
        ]
      }
    ],
    "source": "tce",
    "ruleset": "dnd5e"
  },
  {
    "id": "feat:blazing-revival",
    "class": "subclass:circle-of-wildfire",
    "level": 14,
    "name": "Blazing Revival",
    "description": "The bond with your wildfire spirit can save you from death. If the spirit is within 120 feet of you when you are reduced to 0 hit points and thereby fall unconscious, you can cause the spirit to drop to 0 hit points. You then regain half your hit points and immediately rise to your feet. Once you use this feature, you can't use it again until you finish a long rest.",
    "mechanics": [
      {
        "type": "reaction",
        "trigger": {
          "event": ["damaged_by"],
          "damage": {
            "lethal": true
          }
        },
        "uses": {
          "value": 1
        },
        "recharge": "long_rest",
        "effects": [
          {
            "healing": {
              "calculation": {
                "operation": "divide",
                "operators": [
                  { "type": "attribute", "value": "hit_points.maximum" },
                  { "type": "integer", "value": 2 }
                ],
                "rounding": "down"
              }
            },
            "target": { "type": "self" }
          }
        ]
      }
    ],
    "source": "tce",
    "ruleset": "dnd5e"
  }
]
